{
  "$schema": "http://json-schema.org/draft-07/schema#",
  "title": "Findings file — knowledge-capture format",
  "description": "Machine-readable copy of the canonical schema at findings/README.md (findings/README.md is the authority; this file must not diverge). One file per task at findings/<TASKID>-<slug>.json. Immutable once the Orchestrator ratifies absorption.",
  "type": "object",
  "required": ["task_id", "date", "model", "claims"],
  "properties": {
    "task_id": {
      "type": "string",
      "description": "managent task identifier — e.g. T129, T172. Must match the kanban task ID."
    },
    "date": {
      "type": "string",
      "description": "ISO-8601 date when the finding was produced — e.g. 2026-08-01."
    },
    "model": {
      "type": "string",
      "description": "Model that executed the task — e.g. DSPro, DSFlash, Fable, Consul."
    },
    "claims": {
      "type": "array",
      "description": "Claim status changes proposed by this task. Empty array when none are touched.",
      "items": {
        "type": "object",
        "required": ["id", "proposed_status", "rationale", "evidence_path"],
        "properties": {
          "id": {
            "type": "string",
            "description": "Claim ID as registered in CLAIMS.md §2, e.g. QA-027."
          },
          "proposed_status": {
            "type": "string",
            "enum": ["PROVEN", "CLAIMED", "FALSE-AS-SCOPED", "FALSE", "UNTESTED", "INTRACTABLE", "MEASUREMENT", "SUPERSEDED"],
            "description": "Proposed epistemic status. SUPERSEDED = true when written, overtaken by events (T269). The (definition) pseudo-status is not valid."
          },
          "rationale": {
            "type": "string",
            "description": "One-sentence justification for the status change."
          },
          "evidence_path": {
            "type": "string",
            "description": "Path to evidence file (relative to repo root), typically a PROVENANCE.md."
          }
        }
      }
    },
    "new_rows": {
      "type": "array",
      "description": "New CLAIMS.md rows proposed by this task. Omit or leave empty when none.",
      "items": {
        "type": "object",
        "required": ["id", "legacy", "goban", "claim", "status", "evidence", "depends_on", "narrowed", "wrong_answer_pass_rate"],
        "properties": {
          "id": {
            "type": "string",
            "description": "Proposed claim ID (must follow the CLAIMS.md §1 ID scheme)."
          },
          "legacy": {
            "type": "string",
            "description": "Legacy ID, or \"—\" if minted."
          },
          "goban": {
            "type": "string",
            "description": "Goban scope: \"all\", \"n/a\", \"2x2\", etc."
          },
          "claim": {
            "type": "string",
            "description": "The claim text (may contain markdown)."
          },
          "status": {
            "type": "string",
            "description": "Proposed status."
          },
          "evidence": {
            "type": "string",
            "description": "Evidence path(s)."
          },
          "depends_on": {
            "type": "string",
            "description": "Edge list, same format as CLAIMS.md depends-on column."
          },
          "narrowed": {
            "type": "number",
            "description": "Narrowing count (0 for new rows)."
          },
          "wrong_answer_pass_rate": {
            "type": "string",
            "description": "Rate or \"?\"."
          }
        }
      }
    },
    "notes": {
      "type": "string",
      "description": "Extended notes — gaps, verification, next steps. Optional; prefer the evidence path for detail."
    }
  }
}
