{
  "task_id": "T274",
  "date": "2026-08-02",
  "model": "deepseek-v4-flash",
  "claims": [
    {
      "id": "GLOBAL.TIE-MIGOS",
      "proposed_status": "FALSE-AS-SCOPED",
      "rationale": "Primary sources refute the minted mechanism: MIGOS's long-cycle-tie value is 0 (thesis §5.3.2; ICGA 2009 §3.3 'typically 0'), identical to our TIE=0; MIGOS's own basic-ko 4×4 = +1 = ours (thesis Table 5.1); the +2 anchor arises from the pass-difference cycle-resolution rule (thesis Appendix A §A.4), a different game definition, not a different tie value. Run half (TIE sweep) pending under Orchestrator HOLD D011.",
      "evidence_path": "docs/evidence/GLOBAL-TIE-MIGOS/tie-experiment-T274.md"
    },
    {
      "id": "GLOBAL.FIXPOINT-VS-SEARCH",
      "proposed_status": "CLAIMED",
      "rationale": "Under aligned rules (basic ko, tie 0) weizigo fixpoint (+1) and MIGOS search (+1, thesis Table 5.1) agree, so the +1-vs-+2 gap is a ruleset (cycle-resolution) difference, not a fixpoint-vs-search discrepancy; candidate (b) (defect) is not needed to explain the gap, though our value for our game still awaits the #2 auditor.",
      "evidence_path": "docs/evidence/GLOBAL-TIE-MIGOS/tie-experiment-T274.md"
    }
  ],
  "notes": "Citation correction (not a status change): the register cites 'thesis §6.4' for the 4×4 +2 anchor (4x4.ANCHOR, retrograde-4x4.md:93, AXIOMS.md §4.2); §6.4 is 'Learning connectedness' — the 4×4 solve is thesis §5.4.1 (Table 5.1) + Appendix A §A.4. Tree finding: src/exp6_solve.zig at HEAD does not compile with zig 0.16.0 (fp4_out.data.deinit() const-qualifier error, line 1568; `const fp4_out` at line 1407) — the QA-026-era code (eeec85c) predates the T165–T167/T226 Fixpoint4Output refactor; fixpoint kernels verified semantically identical by diff. Identity note: dispatch said DSFlash (agent field deepseek-v4-flash); Orchestrator directive D011 addressed this seat as deepseek-v4-pro. Run half blocked by D011 HOLD (host memory contention) — no 4×4 run started."
}
