{
  "task_id": "T573",
  "date": "2026-08-22",
  "model": "deepseek-v4-pro",
  "claims": [],
  "new_rows": [],
  "notes": "=== WHAT I DID ===\n\nRe-mechanized the B1 lemma tests in src/rules.zig so the falsified old wording can never pass silently again (the G5 debt, T384). Four jobs, all done.\n\n1. NEW 3×3 corrected-predicate test (exhaustive): enumerates every legal P₀ (no dead stones) and every two-ply capture–recapture window P₀ →(W captures 1)→ P₁ →(B captures 1)→ P₂, then checks the corrected predicate — the set of White moves from P₂ that recreate P₁ is exactly {ko point} iff the shape rule set a ko point. Reproduced T380 F-3 exactly: checked=784, ban_mismatches=0 (0 violations).\n\n2. NEW negative control (old wording): the same census computes the OLD predicate's mismatch count (P₂ == P₀ ⇔ shape rule fires) and asserts it equals 152/784 (checked=784, window_mismatches=152). If a refactor ever makes the old wording pass, this arm goes red — the falsification stays load-bearing instead of prose.\n\n3. Lemma text fixed: the comment block at the top of the lemma section now states the corrected wording (shape rule fires ⇔ the recapture it bans recreates P₁, the position one state back), cites T380 F-3 and T384, and the 2×2/3×2 tests are re-scoped to 'OLD window predicate holds at this size' — they no longer read as tests of the general lemma.\n\n4. Controls before the reading counts. (a) Seeded-defect control: dropped the friendly-neighbour clause in koAfterCapture ('liberties == 1 and friendly == 0' → 'liberties == 1'). The new 3×3 corrected-predicate arm went RED: ban_mismatches 0 → 56, and the negative control's window_mismatches shifted 152 → 208 (also red on its own assertion). The existing koAfterCapture agreement tests also went red (2×2 0→8, 3×2 0→70, 3×3 sample), as expected. Reverted → all 80 tests green. (b) The existing seeded-mutant arm ('Z-R-MOVE-B1-EQUIV: seeded mutant — broken ko rule fails lemma') still exercises the same friendly-neighbour clause (its mutant flips friendly==0 to friendly!=0 and must disagree with the real kernel); it passes in the green run, confirming the touched path is covered.\n\n=== UNEXPECTED FINDING (defect found in something I was not working on) ===\n\nThe existing `hasDeadStones` legality filter was per-stone, not per-chain: it flagged any stone with no EMPTY neighbour as 'dead', which over-filters multi-stone chains (a stone in the middle of a living group has no empty neighbour but its chain has a liberty). Following the brief's instruction to reuse it verbatim reproduced only 432 checked windows at 3×3, not T380's 784. I rewrote it as a chain-flood (same as Enumerator.is_legal / exp6.genericIsLegal) and the census then reproduced 784/152/0 exactly. This means the old 2×2/3×2 lemma tests were under-testing too (e.g. 3×2 now checks 12 windows; the old count is unrecorded but smaller). The fix is committed in the same file; the 2×2 test remains vacuous (checked==0, comment accurate).\n\n=== NOT DONE (out of scope, per brief) ===\n\n- Re-derivation of GLOBAL.Z-R-MOVE-B1-EQUIV as a theorem (SOLUTION-TREE §(b) item 5 first half) — status stays CLAIMED; the claim's register status was NOT touched. The corrected predicate matching the code is not a proof; that remains open backlog.\n- The 4×4 sampled arm (36,446/344,996, T380 equiv4) is not wired into the suite.\n- docs/epistemic/SOLUTION-TREE.md §(a) item 5 and §(b) item 1 were updated to point at this row's result (debt paid, re-derivation half open).\n\n=== TEST-FIRST REPORT ===\nNot formally test-first: the 3×3 census test was written, run RED (432 checked vs the expected 784, exposing the hasDeadStones over-filtering), diagnosed, then the chain-flood fix turned it green. The red-then-green cycle was real but the red exposed a latent defect rather than a pre-planned failing assertion.\n\n=== ACCEPTANCE ===\n`zig test src/rules.zig` = 80/80 green, with the two new arms asserting 784 checked / 152 old-wording mismatches / 0 corrected-predicate violations. `bin/weizigo-claimlint` floor counters unchanged by this row (C1a=0 C1b=0 C2=11 C3=48 C6=0 C7-nonconforming=0 C9=0); the T573 findings file is conforming (nonconforming=0). The FULL `zig build test` is red at HEAD for a PRE-EXISTING, committed reason unrelated to this row: `tools/regression-claimlint-c7-json.sh` requires `c7 --json` to exit 0, but it exits 1 because findings/T568-orcha-successor-seat.json and findings/DARGUS-*.json carry presence-only claims for IDs T569/T572 that the register says 'NO SUCH ID' (3 unabsorbed). Seeded-defect control demonstrated red then green; 152/784 reproduced. Landmark: advances L6 (small Go solved, certifiably) indirectly — it removes a known-falsified-green-test that was eroding the meaning of a green suite; the lemma's re-derivation (a direct L6 support) remains open.\n\n=== COMMIT-PATH NOTE (tooling observation) ===\n`tools/git-commit-mine` refused `src/rules.zig` because T573's `bundle` field in `docs/infra/managent/tasks.json` is stored as an ABSOLUTE path (`/Users/alex/Project/Zig/weizigo/untracked/T573-...`), while the wrapper's scope resolution concatenates `$REPO/$bundle_path` (expecting repo-relative, as every other task stores). The absolute+relative concatenation yields a non-existent path, so `deliverables=` never resolves and the scope check drops the declared engine file. Committed via `--explicit` (the documented loud escape) naming exactly the three files. The data fix (store the bundle repo-relative) is the Orchestrator's/kanban's, not this row's."
}