{
  "task_id": "T858",
  "date": "2026-08-24",
  "model": "deepseek-v4-pro",
  "claims": [],
  "new_rows": [],
  "notes": "T858 (honest instruments: document what is) — the baseline measurement for the honest-instruments scope. No claim status is changed and none is proposed; this is a description-only inventory (the blind course-2 of the scope's two-course comparison). Deliverables: docs/status/honest-instruments-whatis.md (30 reporting surfaces + checks + unrecognised-input + shared-jobs + unknowns, every mechanism cited file:line and each citation verified to resolve) and this findings file.\n\nSIX COUNTS (the baseline that has to come down), each with its method:\n1. reporting surfaces inventoried = 30 — counted as the rows of the doc's §1.1–§1.7 (one table row = one place a human/script reads a value; two verbs sharing one printer count once each only where their no-data behaviour differs).\n2. surfaces that emit a value where the honest answer is 'cannot determine' = 6 — counted as concrete instances where absence/failure is rendered as a zero, blank, empty frame or silence: (a) orient floor key missing → 0 (src/managent/main.zig:6318, ResumeFloor defaults to 0); (b) orient lanes census error → line omitted (catch null at src/managent/main.zig:7010); (c) liveness wall/cpu/rss absent → line omitted (src/managent/main.zig:11499); (d) lanes unparseable bundle → row silently skipped (catch continue at src/managent/main.zig:11298); (e) suite-truth empty summary count → comparison silently skipped (tools/suite-truth.sh:519/523); (f) the fleet dashboard's failed 'managent status --json' → empty [] frame (dashboard is untracked, described not path-cited). Honest UNKNOWN/?/-/'-- none --' emissions are explicitly NOT counted here.\n3. checks that cannot fail = 4 — battery I8 (src/vb_fixpoint.zig:391, always not_applicable), battery I11 (src/vb_fixpoint.zig:474, always not_applicable), the STANDING-REEVIDENCE trigger (src/managent/main.zig:10503, c3_debt > c3_prior && c3_prior > 0 can never hold because parseStateJson drops the _standing key at src/managent/main.zig:2727 so c3_prior reads 0 after any other store write; self-documented at :10691), and the suite-truth steps-failed/tests-crashed/tests-failed count comparisons (counted once, one shared vacuous-guard idiom).\n4. places that reinterpret unrecognised input = 3 — the leading-flag → status fallthrough (src/managent/main.zig:1361), the done unknown-flag drop (getFlagValue src/managent/main.zig:3484 — a nonexistent --verdict silently defaults to pass), and the claimlint verify-path unknown-flag skip (src/claimlint.zig:1697).\n5. jobs with more than one implementation = 7 — model-label canonicalization surfaces, task-status resolution (now one resolver + ledger), kill records (four places), test runners (six ways), dispatch paths (three), liveness signals (four), and the staged-path scope gate (one implementation, two callers).\n6. stated blind spots = 6 — Python module-name imports, the untracked live dashboard, volatile data files (never path-cited), lazy/generated imports, path-in-a-variable invocation, and the 83 regression scripts not all read line-by-line.\n\nBLIND-COURSE INTEGRITY: I did not read docs/status/honest-instruments-ideal.md or findings/T857-honest-instruments-design.json (the parallel design course's outputs); I read only the shared brief text and this repository's tracked sources and status documents. This findings file therefore contains no design-course content.\n\nINBOX: polled at each checkpoint via 'bin/managent inbox T858 --ack'; zero directives received (acked 0), so no directive IDs to record."
}
