{
  "task_id": "T464",
  "date": "2026-08-19",
  "model": "deepseek-v4-pro",
  "claims": [],
  "new_rows": [],
  "notes": "Tooling row, not a claim-status change — no claims/new_rows. ONE status resolver landed: resolveStatus() in src/managent/main.zig is now the only place a task's effective status is computed; status (board), next, liveness and audit all call it, and the assertion ledger is authoritative over tasks.json in BOTH directions (closed→done, dispatchable→dispatchable, in_progress→in_progress, done/absorbed/recommended-close→done), carrying the (asserted: A00NN) marker whenever the ledger speaks. Verified on the LIVE board (read-only): T452 renders dispatchable (asserted A0017, was stored in_progress), T369 renders in_progress (asserted A0016, was stored done), T438/T351/T443 dispatchable (asserted), T430/T433/T440 done (asserted closed) — the backlog's 'seam runs both ways' finding is closed by construction. New retire verb: `managent retire <id> --note <epitaph>` archives any status (incl. dispatchable) to docs/infra/managent/archive.json with a one-line epitaph field on the record (archive, never delete); needs edges cleaned like purge/archive. Controls added to tools/regression-managent-integrity.sh checks 17-20 (closed-asserted absent from next/in-progress/liveness; dispatchable-asserted re-queued in every view; retire moves + epitaph; null arm unchanged), all wired into zig build test via the already-wired integrity regression. Regression status: regression-managent-integrity.sh (20 checks) PASS, regression-managent-ledger-board-seam.sh PASS, plus resume/standing/directive-integrity/inbox-loop/memory-safety/lock/done-git/done-two-phase/claim-lifecycle/duplicate-dispatch all PASS against the freshly built binary. TEST-FIRST DISCLOSURE: the T464 controls were written together with the implementation, NOT shown red first — the fix and the controls landed in the same edit, so the controls prove behaviour, not that they would have caught the defect. Binary is BUILT (zig build -Doptimize=ReleaseSafe) and deployed to bin/managent locally for testing; awaiting the Orchestrator's deploy on a drained fleet per the brief. Inbox checked (T464 --ack): no pending directives."
}
