{
  "task_id": "T378",
  "date": "2026-08-19",
  "model": "glm-5.2",
  "claims": [],
  "new_rows": [],
  "notes": "## T378 context dump (glm-5.2)\n\n### (1) Hypotheses formed and ruled out\n1. **'A simple state value witness (W_pass1 L >= 0) catches the bug.'** RULED OUT by tracing through the linear sweep order. The state `(board=0, side=1=White, ko=N, passes=1)` has children: a terminal at later linear index (already seeded with L=0) plus six placements at EARLIER linear indices (L=-n at first sweep). White's `min` Bellman value picks the placements (L=-n). The buggy guard `best < L_tab[li]` (`-n < -n` = false) and the fixed guard `best > L_tab[li]` (`-n > -n` = false) both leave L at -n. The state value is a `pin_L` (L=-6, H=0) in BOTH buggy and fixed kernels — a single-state value witness does NOT distinguish them. The strong witness is the **Bellman residual** (count of states where Phi(tab) != tab), which catches the bug cleanly: 58 L-residual with buggy L guard, 447 H-residual with buggy H guard, 0/0 with the fix.\n2. **'The bracket invariant L <= H might be violated by the fix.'** RULED OUT by adding `L_tab[li] <= H_tab[li]` to the L-residual test. Both buggy and fixed kernels satisfy the invariant (the buggy kernel's failure mode is non-update, not cross-update). The bracket is always valid; the bug is in tightness.\n3. **'The H sweep comment flip from `best > for White` to `best < for White` is just a documentation fix and changes nothing.'** PARTIALLY RULED OUT: the comment flip is a separate cosmetic fix, but the code at :1024 (`best > H_tab[hi]`) DID need to flip to `best < H_tab[hi]`. The cosmetic fix and the code fix were on the same line; together they restore the monotone-descent direction.\n4. **'The two kernels (qa023_probe and T372) will agree exactly on the pin census after the fix.'** RULED OUT by running them side by side. They agree on pin_L (34), pin_H (34), Bellman residual (0/0), and within ±2 on pin_T (298 vs 296) and within ±1 on non-terminal L==H (~1367 vs 1366). The 3-state reachability divergence (`census` reports 2586 vs 2583 reachable) is the pre-existing `seed_roots` difference (qa023_probe seeds 4 roots `{B0, W0, B1, W1}`, T372 seeds the single root B0 per `F1-CENSUS-GAP new+1`). This is NOT a fix-introduced divergence.\n5. **'Wiring `qa023_probe.zig` into `zig build test` is required by the standing project rule.'** PARTIALLY RULED OUT: the standing rule says `A tooling row is not accepted until its test is wired into zig build test`, but the brief's explicit instruction is `Verify with zig test src/qa023_probe.zig --test-filter <tag>` AND the brief's bar says `Do not raise or relax qa023_brute_2x2's 20M-node fail-fast budget. If your work makes that test's crashes change in any way, stop and report.` Wiring would crash the suite on the pre-existing Brute2x2 crash. Net: filter-verify per brief, do not wire, document the trade-off in the findings file.\n\n### (2) Hazards / smells noticed, not investigated (out of scope)\n1. **The qa023_probe kernel has TWO separate L and H sweeps**, while T372 does a single joint sweep per state. After my fix, the L==H count differs by 1 between the two (1367 vs 1366) and pin_T by 2 (298 vs 296) — within tolerance but indicates that the kernels have slightly different convergence paths. A future row might want to unify the sweep architecture.\n2. **The `seed_roots` over-seeding** (4 roots vs T372's 1) inflates the reachable set by 3 states. This is documented in the census comment (`// Seed: the four true game roots`) but disagrees with T372's single-root convention. A future row might want to either justify the 4-root seeding or align with T372.\n3. **`fixpoint_kernel` is called from three modes in qa023_probe.zig** (`fixpoint-3x2`, `history-pairs-3x2`, `probe-3x2`). The history-pairs and probe modes both use the L/H values to evaluate state worth — the bias fix flows through them automatically. The T13 history-pair evidence at `docs/evidence/QA-023/history-pairs-3x2-2026-07-29.md` was sourced from the buggy version; the bias widened brackets but didn't change the falsification (which relies on bracket-busting values from the truncated evaluator). This is worth a re-run with the fixed kernel to confirm the falsification still holds, but I did not do that.\n4. **`qa023_pinrule.zig` carries a `fixpoint_as_shipped` that is a verbatim port of the now-fixed buggy kernel** (line :425, comment cites `HEAD 8b610ee`). The pinrule file ALSO carries `fixpoint_corrected` (line :558), which is the kernel that produced the published `L==H=1366, pin_T=296, pin_L=34, pin_H=34` numbers. The `fixpoint_as_shipped` function exists for reproducibility of the OLD pin census (`L==H=948, pin_T=1532, pin_L=142, pin_H=0`, cited in the file's comments) — touching it would invalidate that reproducibility. I did NOT touch `qa023_pinrule.zig`. Future: the as-shipped copy will diverge from `qa023_probe.zig`'s kernel unless the project intentionally keeps both as historical anchors.\n5. **No regression test was added at the 2x2 level** — the 2x2 `smoke_fixpoint_2x2` function (line :155) uses a DIFFERENT kernel logic (`bl != t.L[i]`, the unconditional replace) and was never affected by the bug. The 2x2 smoke test still passes after my fix because it's a separate code path. A future row might want to consolidate the kernels.\n\n### (3) Uncertainties in my deliverable\n1. **The exact 3 reachable states that diverge between qa023_probe (2586) and T372 (2583) are not identified.** I traced that qa023_probe seeds 4 roots and T372 seeds 1, but I did not enumerate which 3 states are reachable only from the extra roots. To enumerate, I'd need to compute the BFS closure from each root individually and diff the closures — that's a separate investigation, not part of T378.\n2. **Whether the bias fix changes any published register row's STATUS is uncertain.** The findings file lists evidence files by directory; the actual register rows are in `docs/epistemic/CLAIMS.md`. I did not read CLAIMS.md line by line to enumerate rows citing `qa023_probe` or `pinrule-sufficiency-2026-07-29`. The brief said `Report only — do not demote or re-point any register row` so this is the correct scope. A future row (or the Orchestrator) should cross-reference CLAIMS.md to decide which rows go SUPERSEDED.\n3. **The `seed_roots` over-seeding may or may not be intentional.** The census code comment says `the four true game roots — empty goban × side × passes`, which is a justification for the 4-root seeding. But T372's commentary at `src/t372_zrtie.zig:443` (`Single true game root (F1-CENSUS-GAP's new+1: V = 2,583 at 3x2)`) is equally justified. The project has both conventions; I did not adjudicate.\n4. **The Bellman-residual test's `print` lines may be noisy.** I included `# T378 bellman residual L=0 H=0` etc. as diagnostic output. In production runs (not tests), these would go to stdout. Future readers may want to silence them, but they're useful for one-shot verification.\n5. **The 3-state pin_T divergence (298 vs 296) is real but small.** Both kernels report exact fixpoints (residual 0/0); the difference is in WHICH states end up at L<H with TIE in the bracket. I did not enumerate the diverging states. A future row might want to identify them.\n\n### (4) Misleads / time costs\n1. **Initial witness design (single-state L value) was wrong** — I started with `try expect(L_tab[wl_lin] >= 0)` for `W_pass1`, which traced through but turned out to be a `pin_L` state in BOTH the buggy and fixed kernels. The fix does change the kernel's behavior but not at THAT state. Cost: ~10 minutes of confusion before realizing the strong witness is the Bellman residual, not a single-state value.\n2. **The brief's line numbers (:965 and :1024) were correct** — but I verified them by reading the surrounding code (5 lines before and after each) before applying the fix. The STATE rule 4 (`Verify the two line numbers before accepting them`) saved time here: I confirmed `:965` is in the L-sweep White branch and `:1024` is in the H-sweep White branch BEFORE editing.\n3. **`zig test src/qa023_probe.zig` runs ALL 92 tests from the file and its imports** — when run as a group, it crashes on the pre-existing Brute2x2 smoke test (90 tests at HEAD, 92 after my additions, crash on test 6 at HEAD / test 8 after). Filter-based verification is required to avoid the crash. The brief was right to specify `--test-filter`.\n4. **The pin census numbers from qa023_probe and T372 are not directly comparable** because the former includes terminals in `l_eq_h` and the latter separates terminals. Subtract ~853 terminals from qa023_probe's L==H=2220 to get ~1367 non-terminal L==H, which is 1 more than T372's 1366. This is the kind of comparison that's easy to get wrong at first read; the 2220 vs 1366 raw numbers don't compare.\n5. **The brief said `cross-check the repaired kernel against T372's independent implementation on the shared 3×2 states: they must agree`** — but I found a 3-state divergence in the reach set and small pin census differences. These are NOT introduced by my fix (they pre-exist because of `seed_roots` and sweep-architecture differences), and the kernels agree on the strong property (Bellman residual = 0/0). I documented the divergence in the findings file and did not chase it down to individual states (out of scope per brief).\n"
}
