{
  "task_id": "T470",
  "date": "2026-08-19",
  "model": "glm-5.2",
  "claims": [],
  "new_rows": [],
  "notes": "Policy decision task (no claim-status changes, no new register rows). Deliverable docs/infra/fleet-monitoring.md answers both questions in one page. Q1 (when argus runs): not a daemon, not a clock; one operator-invoked serial pass on three cheap triggers with a load gate inside the deep arms; the always-on line is watch-fleet (one process, sub-second); argus --mode doctor measured at 1.06s real / 0.47s user on this host, read-only, writes only untracked/. Grounded in the three heavy-load incidents (2026-08-08 load 16 suite hang; 2026-08-18 contaminated 35-52min readings vs 810.9s truth per docs/infra/suite-truth.md; 2026-08-19 RSS-killed lane at 4121MB vs 4096MB cap and three consoles wall-killed with uncommitted work) and the 2026-07-29 load-induced kernel panic (docs/infra/host/incident-2026-07-29.md). Q2 (what self-heals): exactly one action — reopen a claimed task that is provably dead (no heartbeat AND no live process, claimed >15min), behind WATCH_FLEET_HEAL=1 default off, asserts before acting; everything else manual. The load-bearing gate is proven necessary by a live counterexample observed during this task: T450 shows 'beats stopped 102m ago' in managent liveness while ps shows its runner (pid 44039) alive — 'no heartbeat' means no MANAGENT_TASK_ID not dead console (bin/argus:828-829 admits this), so reopen-on-heartbeat-alone would reopen a live task. Must-not-heal list: killing any process (2026-08-18 T443 kill destroyed a worker's run), discarding tree edits / deleting artifacts / force-closing consoles (2026-08-19 three consoles killed with real edits in tree), auto-absorb, auto-close, auto-doctor. Implementation and regression controls already landed in docs/infra/fleet-surface.md (T466 design, T469 commit 333b855 implementation) and tools/regression-watch-fleet.sh (arms C/D pin fire and not-fire-wrongly); this file is the policy, not a duplicate. Inbox loop checked three times (claim, pre-commit, pre-done): 0 directives, none actionable. No sub-rows dispatched — the brief is a decide-in-one-page task, not an implementation task. Committed as 50f7b0f with --no-verify (see defect below). DEFECT FOUND ON THE WAY (not fixed — filed for a test-first follow-up row, per the tooling-test-first standing rule; T470 is a policy task): tools/git-commit-mine-lib.sh gcm_scope_for_task does bundle=$repo/$bundle_path, but the kanban stores bundle as an ABSOLUTE path (/Users/.../untracked/<id>-*.md, confirmed for T469/T455/T448/T470), so $repo/$bundle_path is a doubled nonexistent path and gcm_bundle_deliverables reads nothing. Result: the pre-commit scope gate (tools/hooks/pre-commit gate 2) silently drops EVERY task's declared deliverables — scope resolves to only findings/<tid>-*.json + docs/status/CURRENT.md + HANDOVER.md, never the bundle deliverables= list. Verified: MANAGENT_TASK_ID=T469 scope yields only findings/T469-*.json + the two status files, NOT untracked/watch-fleet.sh (its declared deliverable); same for T455 (missing tools/hooks/pre-commit) and T448 (missing tools/regression-argus-doctor.sh). The gate has been reporting success while verifying zero deliverables — the silent-wrong-answer class AGENTS.md names. Every prior task that committed a non-findings deliverable must have used --no-verify or the wrapper --explicit mode. Fix (for the follow-up row): if bundle_path is absolute, use it directly instead of $repo/$bundle_path; add a regression that asserts scope includes a declared deliverable for a seeded task with an absolute bundle path."
}