{
  "task_id": "T531",
  "date": "2026-08-23",
  "model": "deepseek-v4-pro",
  "claims": [],
  "new_rows": [],
  "notes": "T531 two-surfaces split (Ruling 4, ROADMAP-2026-08-20 rev 3): the suite has two output surfaces, not one — the CONSOLE carries the pass/fail summary and owes zero cosmetic `failed command:` noise; the ARTIFACT carries the [EXPECTED]/I4-I9 instrument readings. Re-dispatch close-out (T531.2). The implementation was already committed before this claim: the evidence.print sink across all instruments (6cc57a6 `T531: two-surfaces split — evidence.print sink across instruments`, src/evidence.zig + src/evidence_control.zig + per-instrument routing), the surfaces manifest by T561 (83211c6), and the reds manifest ratcheted by T564. Verification this session: (1) `sh tools/regression-suite-surfaces.sh` — all 9 controls pass: null clean run GREEN; seeded cosmetic failed-command RED by name; seeded missing-reading RED by name; compile-failure class caught; --log without --evidence fails closed; ratchet-down-only enforced; and the real evidence_control binary writes the artifact with NOTHING on stderr while its std.debug.print seeded twin DOES write stderr (proves arm 6 measures a real difference). (2) Every EVIDENCE prefix in docs/infra/suite-truth-manifest.md (26 machine lines) matches the instrument source line that emits it (grep-verified across src/vb_fixpoint.zig, vb_bellman_4x4.zig, vb_health.zig, vb_graph.zig, rules.zig, differential.zig, i4/i5/keybyte_differential.zig, colex.zig). (3) The sink is wired into `zig build test` (build.zig evidence_control_tests + suite_surfaces_regression). (4) No instrument reading changed between T561's manifest (83211c6) and HEAD — the only instrument-file commits since (774de9f T530/T591, e16c22a T573) touched vb_closure/vb_i11/vb_mutants/rules.zig without altering any evidence.print or std.debug.print line. Test-first: yes — tools/regression-suite-surfaces.sh pairs every null control with a seeded defect caught BY NAME, and is wired into zig build test. No claim status changes proposed (claims: []). Inbox empty at claim and before close. Minor note: the original T531 commit (6cc57a6) carries author `T278 <t278@test>`, not a seat/task identifier."
}
