{
  "task_id": "T479",
  "date": "2026-08-19",
  "model": "minimax-m3",
  "claims": [
    {
      "id": "OBSERVATION.LANDMARK-COVERAGE-AFTER-T479",
      "proposed_status": "MEASUREMENT",
      "rationale": "Pre-T479, 8 of 21 non-self live tasks had a fleet-greppable L<n> token via **Landmark:** lines (T430 L4, T466 L1, T467 L2, T468 L1, T473 L2, T474 L2, T477 L1, T480 L4) and 3 more via prose 'erodes toward L<n>' chains (DARGUS/DCLAIM/DRPLAY) — 11 total. Post-T479: 19 of 21 live tasks show a fleet-greppable L<n> token. The 2 unresolved: T438 (shown dispatchable by managent status but managent show reports done on 2026-08-18; treated as done per the brief's 'history stays as written' bar) and --bundle (phantom row with no brief on disk; T468 verdict: NO LANDMARK — question). T458 (propose L8) and T480 (closed during T479's session, post-T468) are both now done, so their earlier BLANK/done status is moot. Of the 19 resolved live rows, 16 are assigned (L<n> without stretch), 6 are stretched (T358 L7?, T433/T434/T435/T436 L1?, T450 L0?). Counted but unresolved: 1 questioned (--bundle), 0 newly proposed (T458 was proposed but is now done; T328 was proposed and was already done). All counts derived from T468's landmark-assignment-2026-08-19.md.",
      "evidence_path": "untracked/T479-apply-landmarks-to-briefs.md"
    }
  ],
  "notes": "T479 sweep on 2026-08-19, operator-side. Counts (from T468's table for live rows): assigned=16 (L<n> verdict, expanded without stretch); stretched=6 (T358 L7?, T433/T434/T435/T436 L1?, T450 L0? — stretch named in each Landmark line); questioned=1 (--bundle, no brief on disk); proposed=2 (T458 → propose L8; T328 → propose L9). No edits to briefs of done rows; no fabricated landmarks; no edits to task text, bars, or deliverables.\n\nBriefs edited (22 total, all under untracked/ except STANDING-*):\n- T351, T352, T353, T357, T362, T364 → added L1 (the dashboard tells the truth)\n- T358 → added L7 (the 5×5 decision, costed) with stretch named\n- T432 → added L1\n- T433, T434, T435, T436 → replaced gate-for-T428 lines with L1 lines (stretch named)\n- T439, T440, T448, T449, T454 → added L1\n- T450 → added L0 with stretch named\n- T452 → added L0\n- T465 → added L4 (the ledger is clean)\n- STANDING-ABSORB, STANDING-CLEANUP → added L4 under docs/infra/dispatch/\n- T458 → no edit (proposed L8; brief stays without **Landmark:** so the operator can rule on the proposal)\n- --bundle → no edit (no brief on disk)\n\nLive rows with L<n> already (not touched): T430 (L4), T466 (L1), T467 (L2), T468 (L1), T473 (L2), T474 (L2), T477 (L1), T480 (L4).\n\nLive rows post-T468, prose-only chains (out of scope — T468's table did not include them): DARGUS, DCLAIM, DRPLAY. They contain the literal phrase 'erodes toward L<n>' so the fleet grep returns a token, but not as **Landmark:** lines. Recommended follow-up: re-run T468's logic on these three, or accept prose-only. Listed under `not_in_t468_table` in this file's notes.\n\nquestion_these (T468 verdict: NO LANDMARK — question; no edit applied):\n- --bundle (set S) — bundle path untracked/T430-phase2-audit.md does not exist on disk; the phase-2 content was delivered under T433; claim_count=0; nothing the row would do would change the ledger.\n\nproposed_landmarks (T468 verdict: NO LANDMARK — propose; no edit applied — operator rules):\n- T458 — propose L8 (the language the project speaks is unambiguous). T468's wording: 'Disambiguating 'row' (task vs claim) on the surface every agent reads on startup is a *language-hygiene* outcome. The map has no landmark for this; the work is real, and the proposal is named in the project's voice: a human can see at a glance whether 'row' means a kanban task or a register claim, because every agent reads the disambiguated file first.'\n- T328 (done) — propose L9 (the fleet can race its own workers on demand). T468's wording: 'Head-to-head model bake-off harness. The map has no landmark for 'we can race models.' L1 covers dashboard truth; this is a different capability — the ability to grade model quality blind — and it is foundational for races 1–5, but races themselves are evidence for L1/L2/L4 rather than landmarks. Propose: a human can run `tools/bakeoff.sh <prompt>` and see the per-model answer, ranked.'\n\nnot_in_t468_table (live, no T468 verdict; not edited to avoid fabrication):\n- DARGUS (set H, dispatchable, added 2026-08-19) — DUTY per docs/infra/duties.md; brief contains 'erodes toward L1' prose; no **Landmark:** line. Out of scope for T479 because T468's table did not cover it.\n- DCLAIM (set H, dispatchable, added 2026-08-19) — DUTY; brief contains 'erodes toward L4'; no **Landmark:** line. Same status as DARGUS.\n- DRPLAY (set H, dispatchable, added 2026-08-19) — DUTY; brief contains 'erodes toward L2'; no **Landmark:** line. Same status as DARGUS.\n\ndone rows skipped (per bar 'Do not edit briefs of done tasks; history stays as written'): T438, T443 (both shown dispatchable by managent status, but managent show reports done on 2026-08-18; treated as done). T473, T474, T477, T480 — these ARE live but added 2026-08-19 after T468's table was published; they already carry their own **Landmark:** lines, so no edit applied.\n\nT479 itself was skipped — the producer's brief obviously carries its own line.\n\nuntracked/task-desc.tsv appended with 8 rows (T432, T433, T434, T435, T436, T439, STANDING-ABSORB, STANDING-CLEANUP) so the fleet view's description column resolves these IDs.\n\nInbox at start: bin/managent inbox T479 --ack returned -- no pending directives --. No D0NN IDs recorded.\n\nThe fleet view (untracked/watch-fleet.sh lm(): grep -ho 'L[0-9]' untracked/<id>-*.md | head -1) now resolves a landmark token for every live task that has a brief on disk. The fleet surface will stop showing blank landmark columns for the L1-stretch audit rows (T433-T436) and the standing tasks, which were the most visible gaps. The prose chains added in this sweep are T468's verbatim or close paraphrase; a reader who wants the reasoning can open docs/status/landmark-assignment-2026-08-19.md."
}
